불용어 제거 리뷰,키워드,제품명,피부타입,기능
이거 리뷰에 가끔 배게에 묻어나요ㅜㅜ 이런말있어서 걱정했으나 저는 크게 묻어남 없었습니다 자극감은 없고 맛이 신맛이 나용 입에 들어가서 먹게되었습니다 흡수다되면 피부가 쫀덕 느낌이 됩니다 뭔가 큰 효과는 며칠 사용치않아 모르겠으나 한달리뷰로 돌아오겠습니다,"이거, 리뷰에",코스알엑스 더 비타민C 23 세럼,복합성,"주름개선, 미백"
트러블이 올라와있는 상태라 사용 못 하는 중이라 효과는 모르겠네여 ㅜ 빨리 사용해서 하얘지고싶아요,"트러블이, 올라와있는",코스알엑스 더 비타민C 23 세럼,복합성,"주름개선, 미백"
올리브영에서 1위라고 해서 기존 사용하던 제품이 끝이 보여서 주문해봤어요 1 1 1 잘 구입했어요 세럼 덕에 나도 깨끗하고 주름없는 피부로 살고 싶네요 오늘드림으로 저녁늦게 받았어요,"올리브영에서, 1위라고",코스알엑스 더 비타민C 23 세럼,복합성,"주름개선, 미백"
쿠ㅍ에서 써보고 올영세일하길래 재구매해요 한통 다 썼을때 잡티 줄어들었고 이주정도 안 발랏는데 잡티 올라와서 급하게 구매했어요 처음엔 살짝 따가운데 피부가 예민하신분은 테스터같은거 받아서 써보시고 본품 구매하시길 추천드려요 저는 속건조만 있는 건성인데 사실 피부타입 속건조가잇다 말곤 잘 모르겟어요,"쿠ㅍ에서, 써보고",코스알엑스 더 비타민C 23 세럼,복합성,"주름개선, 미백"
갑자기 피부가 뒤집어져서 유튜브로 막 찾아보다가 발견한 제품이에요 유튜버들이 좋다고는 하는데 사실 거 믿기 힘들잖아요 ㅠ 저도 고민이 많았는데 구매를 고민할 정도의 피부 컨디션이 아니었어요 뭐라도 빨리 발라서 진정을 시켜야 할 정도로 나쁜 컨디션의 피부가 돼서 이걸 꾸준히 바르니까 괜찮아졌어요 피부 고민이 있으신 분이라면 꼭 한 번은 시도해볼만 하다고 생각해요 어디서 이상한 냄새가 난다 했더니 범인은 이것 비타민씨 냄새가 이렇다고 하니 손 닦으면서 썼는데 취향은 아니에요 미백은 효과 못 봤어요,"갑자기, 피부가",코스알엑스 더 비타민C 23 세럼,복합성,"주름개선, 미백"
열자마자 알약 캡슐 향이라 해야 되게 역한 향이 올라오더라구요 발라도 되는 건가 싶었지만 바르고 나서 일정 향이 올라왔습니다 ㅠ 제가 피부에 안맞는 제품 바르면 턱 주변이나 볼이 간질간질한데 턱 주변이 간지럽더라구요 ㅠ 써보자 싶어서 스킨 케어 제품 열어봤는데 냄새 나서 다시는 안 쓸 거 같아요 ㅠ,"열자마자, 알약",코스알엑스 더 비타민C 23 세럼,복합성,"주름개선, 미백"
이거 살았는지 기억이 안나염 인생템임 나만 알기 아까워서 다 추천하고 다님 자극은 있어여 피부컨디션 안좋은날엔 이거 맞아 싶을 정도로 따가울때도 있음 냄새도 참치캔기름임 이거 바르면 손도 노래지고 잘 안말리면 베개도 노래짐 개봉하고 후딱 써야지 안그럼 산화돼서 더 노래진대요 근데도 저는 이거 3통째 쓰고있습니다 이니프리 비타앰플도 써봤는데 보습미백 둘다 코스알엑스 압승ㅋㅋㅋ 민감하신분들은 이니프리가 나을거같기도한데 급속미백 원하시는 분들은 이거 무조건 사세요 약국템으로도 없애기 쉽지않던 잡티들 없어지는건 말할것도 없고 피부가 진심 말갛게 하얘짐 친구들이랑 인생네컷 찍고 하면 확실히 티남 저는 전에 기획으로 준 펩타이드 세럼이랑 궁합 잘맞는거같아서 피부 컨디션 평소엔 리샷 민감한날엔 펩타이드세럼 쓰고 비타세럼 두번씩 레이어링하고 한 5분정도 말려놨다가 위에 보습감 있는 에센스고쥰 밀크랑 고보습 크림으로 마무리하는데 확실히 조음 나이트케어용으로만 쓰세요 낮에 괜히 바르고 선크림 바르면 뭔가 찝찝함ㅋㅋㅋ,"이거, 살았는지",코스알엑스 더 비타민C 23 세럼,복합성,"주름개선, 미백"
왕귀여움 왕좋음 냄새도 좋름 가성비도 좋음 꼬옥 사야하는 제품,"왕귀여움, 왕좋음",구달 청귤 비타C 잡티케어 세럼,건성,"잡티, 보습"
1 향이 좋아요 개인적으로 상큼한 향이 좋았어요 2 피부가 쫀쫀해요바르고 나면 쫀쫀하게 스며들어요 3 묽은 제형이지만 흘러내리지 않아서 좋았어요 1 가격이 넘 비싸요세일할 안 사용 2 잡티가 사라지는지 의문이에요꾸준히 썼는데 드라마틱한 큰 효과는 없었어용 3 사바사로 친구는 제품을 쓰고 피부가 뒤집어졌습니다 테스트 하시고 구매하세요예민하신 분들 주의 4 미백효과가 있다고 하는데 없어요,"향이, 좋아요",구달 청귤 비타C 잡티케어 세럼,건성,"잡티, 보습"
비타민 가 풍부해 피부의 잡티와 톤을 개선하는 데 효과적입니다,"비타민, 풍부해",구달 청귤 비타C 잡티케어 세럼,건성,"잡티, 보습"
상큼한 구달 콜라보 워낙 잘 썼던 제품이라 샀습니다,"상큼한, 구달",구달 청귤 비타C 잡티케어 세럼,건성,"잡티, 보습"
파우치 귀여워서 샀는데 음잘 모르겠어요 이거 때문인지는 몰라도 쓴 뒤에 트러블이 올라와서세럼 때문이 아닐수도 있지만 쓰기가 꺼려지네요ㅠ 저랑은 잘 안맞는 같아서 아쉬워요ㅠㅠ,"파우치, 귀여워서",구달 청귤 비타C 잡티케어 세럼,건성,"잡티, 보습"
산뜻한 제형으로 흡수가 빠르고 잡티 개선에도 효과적이에요 리필 포함이라 가성비가 뛰어납니다,"산뜻한, 제형으로",구달 청귤 비타C 잡티케어 세럼,건성,"잡티, 보습"
피부가 예민해서 비타민 제품 잘 못 쓰는데 유일하게 꾸준히 쓰고 있어요 매일 쓰면 잘 모르는데 다른거 쓰다가 오랜만에 쓰면 효과가 확실히 보이는 제품이라 늘 화장대에 있네요,"피부가, 예민해서",구달 청귤 비타C 잡티케어 세럼,건성,"잡티, 보습"
수분감있게 투명하고 산뜻하게 발림 여름철에 쓰기 좋음 끈적임도 전혀없고 향도 없어서 휘뚜루마뚜루 바르기 가넝 귀여운 여행용샘플까지 항상 애용하고 재구매하는 중,"수분감있게, 투명하고",구달 청귤 비타C 잡티케어 세럼,건성,"잡티, 보습"
제품 샀을때 성분 걱정 했는데 다행히 트러블은 안나더라구요 한달간 사용해봤는데 큰 효과는 못 봤습니다 가볍게 사용하기 좋은 라이트한 텍스처에 촉촉하게 흡수돼서 봄 겨울 다 사용하기 좋은데 저는 건성이라 아무래도 쌀쌀해지는 계절에 요거 하나만 바르기엔 살짝 건조하더라구요 수분세럼 필수 비타민세럼 대부분 다 써봤는데 넘버인 5번이 잘 맞았고 잡티케어보다 얼굴 톤 개선 미백 요쪽으로 찾으시는거라면 좋아하시면 이니스리 제품 추천드릴게요,"제품, 샀을때",구달 청귤 비타C 잡티케어 세럼,건성,"잡티, 보습"
먼작귀 콜라보 패키지 귀여워요 구달 비타 세럼은 가을겨울쯤에 사용해주기 좋아요,"먼작귀, 콜라보",구달 청귤 비타C 잡티케어 세럼,건성,"잡티, 보습"
막이 씌어진 느낌이긴 합니다 끈적하구요 특히나 엄마가 좋아하세요 얼굴톤이 밝아지신듯요,"막이, 씌어진",구달 청귤 비타C 잡티케어 세럼,건성,"잡티, 보습"
선착순쿠폰 당첨되서 오늘드림으로 빠르게 받앗습니다 구달잡티세럼 말모말모 요즘 애껴서 조금씩 잘 사용중이에요,"선착순쿠폰, 당첨되서",구달 청귤 비타C 잡티케어 세럼,건성,"잡티, 보습"
먼작귀 콜라보가 귀여워서 남았는데 더 구매해서 미리 쟁여놨어요 먼작귀도 귀엽고 대용량도 좋네요 기능성 에센스라기보다 저는 보습 에센스로 데일리로 매일 사용합니다 수부지 피부인데 피부 속이 쫀쫀해지는 느낌이라 촉촉해서 손이 자주 가요 쫀쫀한데 끈적이지 않아서 사용감이 좋아요,"먼작귀, 콜라보가",구달 청귤 비타C 잡티케어 세럼,건성,"잡티, 보습"
만작귀 파우치라니진짜 귀엽고 깜찍하고 사실 세럼보다 파우치가 귀여워서 샀어욤,"만작귀, 파우치라니진짜",구달 청귤 비타C 잡티케어 세럼,건성,"잡티, 보습"
솔직히 큰 효과가 있는지는 모르겠으나 콜라보가 귀엽고 제품은 무난해요,"솔직히, 효과가",구달 청귤 비타C 잡티케어 세럼,건성,"잡티, 보습"
아직써보기전이라 리뷰가 좋아서 구매했어요 좋았으면 좋겠어요,"아직써보기전이라, 리뷰가",구달 청귤 비타C 잡티케어 세럼,건성,"잡티, 보습"
항상 구매해요 재고 떨어지지 않게 미리 미리 구입합니다 패키지도 귀여워요,"항상, 구매해요",구달 청귤 비타C 잡티케어 세럼,건성,"잡티, 보습"
매장에서 딸 잡티 구매해서 살짝 써봤는대 넘좋은거있죠 세일에 제꺼 대용량으로 구매오늘 드림으로 30분만에 대용량이네요 세일 자주했으면 좋겠어요크림이 품절이라 아쉽네요,"매장에서, 잡티",구달 청귤 비타C 잡티케어 세럼,건성,"잡티, 보습"
두통째 비우고있는데 좋습니다 바르면 점점 하얘져서 좋습니다,"두통째, 비우고있는데",구달 청귤 비타C 잡티케어 세럼,건성,"잡티, 보습"
2주잡티세럼 구달 자주 사용해요 잡티없어지는거는 모르겠고 더 안생기게 사용해요 파우치 귀여워요,"2주잡티세럼, 구달",구달 청귤 비타C 잡티케어 세럼,건성,"잡티, 보습"
좋네요 뭔가 내 피부가 괜찮아 지고 있는 같아요ㅎㅎ,"좋네요, 뭔가",구달 청귤 비타C 잡티케어 세럼,건성,"잡티, 보습"
친구 생일선물로 줬는데 아직두 잘 쓰고 있다고 하네용 워낙 유명한 제품이다 보니 세일할 쟁여두면 좋을 같아유,"친구, 생일선물로",구달 청귤 비타C 잡티케어 세럼,건성,"잡티, 보습"
구달에서 파우치를 사면 세럼을 증정아님으로 준다길래 구매했습니다ㅎㅎ 왜냐면 현지 가도 파우치 사려면 이정도 돈은 줘야하기 때문이져 파우치는 가르마하치와레가 나왔습니다 자수 실 색이나 퀄리티가 저렴한 느낌이라 쬐끔 아쉽지만 귀여워요 제가 구매했던 당시 가격은 26900원이었고 올영세일 선착순쿠폰으로 아이패치 제품까지 구매해서 3000원 할인도 받았어요 세럼 써봤는데 마시는 곤약젤리같이 몽글몽글한 제형이더라구요 크림이랑 섞어쓰니까 넘 향긋하고 좋았어요,"구달에서, 파우치를",구달 청귤 비타C 잡티케어 세럼,건성,"잡티, 보습"
세럼 유명해서 사봤는데 명성이 자자한 이유가 있네요 젤같은 제형인데 묽지 않고 흡수 쫀쫀히 잘 돼요 워낙 흡수가 잘 되는 편이라서 효과도 괜찮게 나오는 같아요 한 유의하셔야할 점은 비타민가 들어있으니 냉장보관을 추천드리고 나이트케어 도포하시는게 좋습니다 데이케어 바르게 되시면 꼼꼼한 선케어는 필수입니다,"세럼, 유명해서",구달 청귤 비타C 잡티케어 세럼,건성,"잡티, 보습"
몇통을 썼는지 기억이 안날정도로 꾸준히 재구매하고 있어요 사실 미백효과까진 직접적으로 느껴지는건 잘 모르겠고 에센스 발림성도 넘 좋고 쫀쫀하고 은은한 향까지 좋아서 잘쓰고 있어요 피부 상태가 좋은날이던 안좋은날이던 자극적이거나 따가운것도 없구요 화장하기전에도 사용하면 피부가 쫀쫀해져서 화장도 잘먹습니다 써보시면 쫀쫀하다는 느낌이 어떤건지 아실거에요 지성피부인데 끈적임이 아니라 피부가 쫀쫀해지는 느낌입니다,"몇통을, 썼는지",구달 청귤 비타C 잡티케어 세럼,건성,"잡티, 보습"
사용계기 비타민가 함유된 제품을 써봤는데 피부에 잘 맞아서 구매하게 되었어요 당시 제품을 썼을때 비타민 사용하면 피부결이 정돈되고 붉은기가 진정되어 조금은 피부톤이 환해지는 느낌이었습니다 구달제품을 선택한 이유는 민감성피부도 사용할 수 있는 저자극성 제품이라는 것 보존제 피부에 유해한 18가지 성분을 뺀 제품이라는 것 비타민 함유량이 높은 청귤에서 추출한 용액을 사용하였다는 점때문에 구매하게 되었습니다 사용감자극감 피부에 바르면 찐득한 느낌 상쾌해요 금방 흡수됩니다 발랐을때 산뜻해요 대신 수분감은 없습니다 비타민는 자칫하면 자극감이 심한데 제품은 자극감은 없었습니다 개인차가 있을 수 있으니 비타민제품을 얼굴에 발라본적이 한번도 없으신 분들은 소량 테스트 해보고 사용하시길 권합니다 향 상큼한 시트러스 향이에요 인공적인 향이 아니라 만족하였습니다 잡티피부톤피부결에 미치는 영향 효과 저는 주로 밤에 바르고 자는데 다음날 피부를 확인해보면 피부결이 매끈하고 톤이 정돈된 느낌이었어요 비타민 제품을 이용했을때와 같은 느낌이었습니다 제품은 스팟케어제품이었는데 제품은 얼굴 전체에 발라서 전체적으로 효과를 본 느낌이라는게 차이점이에요 피부톤이 밝아진 느낌은 아닌데 한 6개월정도 꾸준히 사용하면 효과를 기대할 수 있지 않나 싶어요 아무래도 화장품에서 드라마틱한 변화를 기대하기는 힘들죠 피부결정돈 된 것만해도 만족스럽습니다 전체적 사용후기 사용감 무겁지 않고 피부결이 눈에띄게 매끄러운 느낌이라 너무나도 만족스럽습니다 제품을 통해서 비타민 제품에 더욱 눈을 뜨게 되었고 제품도 더 구매해보려구요 수분감이 부족할 수 있기 건성이신 분들께는 별로 추천드리지 않아요 바르더라도 수분감 충분한 스킨 로션 크림제품을 바르고 쓰시는 것을 권장합니다 총평 비타민 스킨케어 제품 입문용으로 추천 피부결 잡티 고민이신분께 추천 복합성 지성이신분들께 추천해요 베키의 코멘트 저는 스킨구달세럼로션 순으로 바르고 있어요 묽은 수분감있는 제형이기때문에 유분기 있는 크림 로션제품 전에 바르시기를 추천드립니다,"사용계기, 비타민가",구달 청귤 비타C 잡티케어 세럼,건성,"잡티, 보습"
세럼은 가벼운 텍스처로 피부에 빠르게 흡수되며 사용 후 즉각적인 수분감을 느낄 수 있었습니다 잡티 케어에도 효과적이어서 점점 밝아지는 피부를 확인하고 있습니다 리필이 포함된 기획 제품이라서 더 좋고 파우치도 편리하게 사용할 수 있어 만족스럽습니다,"세럼은, 가벼운",구달 청귤 비타C 잡티케어 세럼,건성,"잡티, 보습"
꿀템이라고해서 사봤었는데 저는 크게 변화를 느끼지못했어요 저한텐 뭔가 무겁고 끈적끈적한 느낌이여서 손이 자주가지않는거같아요 효과를 못봤을수도있고 여드름이 있는 피부라 뭔가 여드름을 가라앉힌다음에 써야할거같은느낌 이라서 이걸 꾸준히 바르려고하면 피부가 못나서 여드름이 한개씩 나가지구 꾸준히 못바르게되네요 얼른 피부를 진정시키고 꾸준히 열심히 발라서 찐후기로 가져와볼게용,"꿀템이라고해서, 사봤었는데",구달 청귤 비타C 잡티케어 세럼,건성,"잡티, 보습"
좋아요꾸준히 쓰면 나는 잘 몰라도 6개월쯤 만에 보는 사람들은 얼굴맑아졌다고 100명 중 한명 말함 3개월쯤 보면 모름ㅋㅋ쟁여놓고 씀근데 요샌 건조해서 레티놀을 집중 쓰느라,"좋아요꾸준히, 쓰면",구달 청귤 비타C 잡티케어 세럼,건성,"잡티, 보습"
상큼한 향기가 좋아서 바를 때마다 기분이 좋습니다 2주 사용 후 효과 기대해봅니다,"상큼한, 향기가",구달 청귤 비타C 잡티케어 세럼,건성,"잡티, 보습"
드라마틱하지는 않지만 꾸준히 쓰면 한 6달만에 만난 사람들이 얼굴환해졌다 얘기함 3달만에 만나는 사람들은 모름ㅋㅋ,"드라마틱하지는, 않지만",구달 청귤 비타C 잡티케어 세럼,건성,"잡티, 보습"
아직사용전인데 피부환해졌으면좋겠어요ㅎ써보고다시ㅎ,"아직사용전인데, 피부환해졌으면좋겠어요ㅎ써보고다시ㅎ",구달 청귤 비타C 잡티케어 세럼,건성,"잡티, 보습"
다들 괜찮다고 해서 샀는데 괜찮더라고요 비타민씨가 흡수되는느낌이랄까 엄마랑 쓰는데 엄마도 좋다네요 정착할것같아요,"다들, 괜찮다고",구달 청귤 비타C 잡티케어 세럼,건성,"잡티, 보습"
써보진 않았지만 잡티제거에 좋대서 구매해요 한달리뷰 나증에 쓰러 올게영,"써보진, 않았지만",구달 청귤 비타C 잡티케어 세럼,건성,"잡티, 보습"
넉넉한 용량에 귀여운 파우치까지 있어서 안살 수가 없었어요ㅎㅎ 촉촉하고 산뜻해서 재구매했는데 좋아요,"넉넉한, 용량에",구달 청귤 비타C 잡티케어 세럼,건성,"잡티, 보습"
일년 넘게 재구매중ㅇㅂ니다 세일할때 쟁여놧어요ㅎㅎ,"일년, 넘게",구달 청귤 비타C 잡티케어 세럼,건성,"잡티, 보습"
잡티때문에 구매해봤어요 자극적이지않고순해서좋아요 바로면 금방흡수됩니다 건강해지는느낌이에요,"잡티때문에, 구매해봤어요",구달 청귤 비타C 잡티케어 세럼,건성,"잡티, 보습"
자주쓰고 있어요 건조합도 덜하고 아주 좋은 제품같아요 자주구매할듯,"자주쓰고, 있어요",구달 청귤 비타C 잡티케어 세럼,건성,"잡티, 보습"
수분감 낭낭한 세럼이라 건성피부가 쓰기도 좋은 미백세럼이에요 쓰고안쓰고가 은근히 차이나서 목에도 잘 발라주면 좋아요,"수분감, 낭낭한",구달 청귤 비타C 잡티케어 세럼,건성,"잡티, 보습"
비타민이 잘 맞는 피부라서 넘 잘 썼어요 비타민 세럼 자극도 안 느껴지는 편이었고 꾸준히 쓰니 효과도 있었어요 환절기나 겨울철에 쓰기에는 건조해서 크림 필수예요,"비타민이, 맞는",구달 청귤 비타C 잡티케어 세럼,건성,"잡티, 보습"
귀여원서 좋고 파우치도 줘서 대박임 매일매일 바르는데도 양이 안줄어요 양 많아요,"귀여원서, 좋고",구달 청귤 비타C 잡티케어 세럼,건성,"잡티, 보습"
흔적관리하고 싶은날에는 구달로 해주는 편 준 파우치가 귀여워서 좋앙ㅅ,"흔적관리하고, 싶은날에는",구달 청귤 비타C 잡티케어 세럼,건성,"잡티, 보습"
두개 샀는데 두개나 우사기 나온건 아쉽지만 ㅠ 쟁여둘 정도로 부모님이 좋아하세요,"두개, 샀는데",구달 청귤 비타C 잡티케어 세럼,건성,"잡티, 보습"
우사기 파우치도 받아서 좋고 병에 그림 있는것도 귀여워,"우사기, 파우치도",구달 청귤 비타C 잡티케어 세럼,건성,"잡티, 보습"
하치와레 나와서 넘 행복해용 넘 귀여웅냐 굿 효과는 미미하고 피부가 더 안 좋아지는 거 같아 몸에 바르고 있어용,"하치와레, 나와서",구달 청귤 비타C 잡티케어 세럼,건성,"잡티, 보습"
구달 청귤세럼 자극적이지않고 메이크업 할때도 피부에 먼저 바르고 쿠션 두드리면 확실히 화장 촉촉하게 잘 먹어요ㅎㅎ 기미가 좋아져서 구달 청귤크림도 사용하고 있습니다ㅎㅎ,"구달, 청귤세럼",구달 청귤 비타C 잡티케어 세럼,건성,"잡티, 보습"
바르니까 촉촉해요 끈적이지 않아요 향이 좋아요 리필용으로 나와서 환경도 챙기고 있는 걸 다 쓰고 쓸 수 있어요 좋아요 피부가 부드러워져서 꾸준히 사용하고 싶어요 자극도 없어요 차갑게 사용하면 알로에처럼 진정에도 좋아요,"바르니까, 촉촉해요",구달 청귤 비타C 잡티케어 세럼,건성,"잡티, 보습"
지성피부인데 가을이 되니 날씨가 건조해져서 보습 겸 미백 용으로 나이아신아마이드 에센스 구매했어요 여드름자국에는 나이아신아마이드가 좋다고 하던데 제품도 많지만 제품이 크게 할인하고 있어서 구매했습니다 평소 사용하던 로션 전에 제품 발라줬어요 흔적 케어 효과는 반신반의했는데 여드름자국이 빠르게 옅어지는 효과를 체감했어요 2주 만에 없어진다 평소보다 빠르게 옅어진다입니다 지금은 한 통 다 비우고 리필 채운 상태예요 리필도 본품이랑 용량이 똑같아서 긴가민가했는데 캡을 닫을 수 있어서 남기고 채웠습니다 유리병인데 리필만 따로 판매해줬으면 좋겠어요 파우치에 뭐가 묻어서 와서 아쉬웠습니다살짝 세척하니까 지워지긴 했지만 아쉬웠어요 아무튼 리필 별도판매면 재구매 의사 있는 제품입니다,"지성피부인데, 가을이",구달 청귤 비타C 잡티케어 세럼,건성,"잡티, 보습"
먼작귀 좋아하면 꼬오옥 사세요 요즘 잡티와 미백에 고민이 많아 그에 맞는 기능을 찾고 있던 중 해당 제품을 보게 되었는데 먼작귀 콜라보가 남아있더라구용 구매하였습니다 잡타와 미백에 효과 좋습니다 흡수도 빨리 되나 수분감을 가지고 있더라구요 전에 바르고 일어나면 날 맑고 화사한 피부가 연출이 되어 좋았습니다 제가 비타민이 함류가 된 제품이 안 맞는지 뾰루지가 올라와서 지금은 사용 중단 하였습니다너무 슬픔,"먼작귀, 좋아하면",구달 청귤 비타C 잡티케어 세럼,건성,"잡티, 보습"
쟁여둔것도 여러개 있는데 쟁이네요 온가족이 쓰다보니 쟁여둬야 든든해요,"쟁여둔것도, 여러개",구달 청귤 비타C 잡티케어 세럼,건성,"잡티, 보습"
아이오페 레티놀은 오특이나 라방할때 사는게 짱인것같아요ㅋㅋㅋ38500원에 사은품이 저렇게 잔뜩 오네요 급하신거 존버하다 오특때 사세요 보통 달에 한번씩은 하는것 같아요 제가 레티놀이 잘맞아서 종류별로 다 써보는데 아모레 계열이 자극도 적고 좋은것 같아요 최애는 아이오페 아이오페 슈퍼바운스 건성 민감성에 추천 셋중에 자극 적고 건조해지는게 덜해서 건성이나 민감성 분들께 추천드려요 이니스프리는 건조해짐이 심한 편이었고 프리메라는 가끔 자극이 느껴지곤 탄력 결 개선 트러블 예방 제가 레티놀을 사용하는 큰 이유는 속에서 올라오는 트러블 방지입니다 확실히 레티놀 사용할때에는 속에서 곪은 트러블이 올라오지 않아요 순하고 전반적인 효과를 원한다면 추천 프리메라 비타티놀 건성약한지성까지 추천 살짝 묵직한 감이 있어서 지성분들은 답답하게 느끼실 수도 있을것 같아요 비타민 특유의 냄새랑 기름층이 살짝 올라오는것도 있습니다여름기준 여름지나면 레티놀 특유의 건조해짐이 있어서 건성분들은 보습 잘 해주셔야 돼요 탄력 미백 결개선 각질제거 사실 효과는 비타티놀이 강력한 같아요 드라마틱한 효과를 싶으시면 비타티놀 추천드려요 대신 살짝 자극적인 감이 있어서 저는 23일 연속 사용 후 하루 쉬어주는 주기로 사용합니다 트러블 예방효과는 살짝 약한것 같긴 했어요 드라마틱한 미백탄력 효과를 원한다면 추천 이니스프리 시카 레티놀 수부지 지성 추천 묽고 건조해요 성분이 들어있어서 뽀드득한 느낌이 정도라 건성분들에게는 비추에요 저는 올여름엔 기름이 올라와서 이니스프리 사용중인데 여름인데도 건조함이 느껴집니다 각질제거 트러블 예방 결 개선 모공세럼의 느낌이 나기도 하는 제품이에요 각질피지를 없애주는 느낌이라 화농성여드름이 고민이시거나 산뜻한 관리를 원하시는분들께 추천이에요 저한테는 살짝 과한 느낌이 나기도 해서 3일 사용 후 하루 쉬어주는 주기로 사용중이에요 각질피지위주로 관리를 원한다면 추천 이니스프리 수부지 건성 추천 묽은 제형이지만 시카보단 유분기가 있어요 기존 이니스프리 레티놀이 잘 맞으셨던 분들이 가을겨울에 사용하기 좋을 듯 결 개선 탄력 레티놀의 느낌보다는 영양 콜라겐 느낌이 강한 세럼이었어요 자극도 덜한 느낌이었습니다 적당한 영양탄력 관리를 원한다면 추천,"아이오페, 레티놀은",아이오페 레티놀 슈퍼 바운스 세럼,복합성,"주름개선, 보습"
