불용어 제거 리뷰,키워드,제품명,피부타입,기능
레티놀 잘 모르고 사용했다가 피부 뒤집졌던 적이 있었어요 악건성 피부라서 회복하는데 오래 걸렸어요 레티놀은 함량이 중요한데 첫 입문자라면 낮은 함량부터 점차 높여가는걸 추천해요 아이오페를 선뜻 구매하기에는 금액대가 있어서 고민이었는데 결론적으로는 피부 뒤집어짐 없고 건조함도 없었어요 꾸준히 사용중인데 늘어진 모공이 쫙 당겨지는 느낌이 들었고 실제로도 모공이 줄어들고 탄력감이 붙은게 눈으로 보여지더라구요 끈적거리거나 기름기가 아닌 촉촉한 광채 피부를 만들어주는데 흡수도 굉장히 빠르고 보송한 마무리감이 좋았어요 악건성이고 민감한 피부가 발랐을때 여러제품들을 발라봤지만 제품만 따끔한 느낌 자극이 되지 않았던 점에서 저와 같은 피부타입을 가진 사람들에게 도움이 되었으면 좋겠어요 주의 레티놀은 열에 약하기 낮에 바르면 선크림 필수에요 글이 도움이 되셨다면아래에 도움돼요 엄지버튼 꾹 눌러주시면 감사하겠습니다,"레티놀, 모르고",아이오페 레티놀 슈퍼 바운스 세럼,복합성,"주름개선, 보습"
타브랜드에서 레티놀 오일이나 세럼 나오지만 함량으로 따지면 아이오페 이길 수가 없더라고요 제형 자체도 일반적인 세럼이라기보다 로션에 가까운 제형이에요 흡수나 발림성은 굉장히 좋고요 제형이 꽤 되직한 로션제형이니 세럼이나 기초제품 레이어드 하실 때는 묽은제형에서 되직한 제형으로 레이어드 하셔야한다는 꼭 참고해주시고요 레티놀이라서 나이트케어 도포하시는게 좋습니다 나이아신아마이드와 사용하시는 분들께서는 나이아신아마이드를 먼저 쓰시고 레티놀을 쓰셔야합니다 펩타이드 세럼을 쓰시는 분들 펩타이드 먼저 쓰시고 레티놀 쓰셔야하고요 히알루론산 판테놀 세라마이드 성분이 들어가있는 것들은 레티놀을 쓰시고나서 단계에 쓰셔야합니다 레티놀의 부작용 중 하나가 건조해질 수 있는 것이기 그렇습니다 제형 봐가면서 스마트하게 잘 사용하세요,"타브랜드에서, 레티놀",아이오페 레티놀 슈퍼 바운스 세럼,복합성,"주름개선, 보습"
한달이상 후기 만족스럽게 사용후 여러번 재구매한 제품이에요 나이트케어용으로 사용하기 좋아요 기획 구성은 계속해서 바뀌던데 스텝3 크림 기획구성일때 구매했고 스텝3 크림도 좋았어요 레티놀 사용이 처음 이거나 민감하신 분들이 사용하기 좋은 제품이에요 자극이 적고 트러블 부담없이 사용 가능한 제품이라 좋았어요 0015 레티놀을 함유하고 있고 레티놀 입문자템으로 데일리로 탄력과 모공관리하기 좋아요 산뜻하지만 촉촉하게 발리는 제품이에요 사용해보면 다음날 피부가 매끄러워지는게 느껴지고 탄력도 생겨서 만족스러운 제품이에요 낮과 밤에 사용이 가능하며 낮에는 꼭 자외선 차단제를 발라줘야해요 참고사항 저자극 제품이긴하나 처음 사용할 때에는 소량으로 시작해서 양을 늘려 사용하길 추천드려요 레티놀 제품이다보니 갑자기 많은양 사용하면 피부가 놀라서 자극이 될수 있어요 레티놀 제품은 나이아신아마이드 세콜지 히알루론산 매트릭실 등과 같은 제품과 사용시 궁합이 좋아요,"한달이상, 후기",아이오페 레티놀 슈퍼 바운스 세럼,복합성,"주름개선, 보습"
부모님 선물로 드리니 제품 현재 쓰시면서 아주 맘에 들어 하시더라고요 발림성이 좋고 흡수력이 끈적이지 않아 괜찮다고 합니다 자극도 그리 큰 편이 아니라서 무난하게 사람들이 대중적으로 쓰기 좋은 같아요,"부모님, 선물로",아이오페 레티놀 슈퍼 바운스 세럼,복합성,"주름개선, 보습"
아이오페 레티놀이 좋다는 후기를 구매 기존에 사용해본 레티놀 제품들은 노란빛을 띠고 있었는데 얘는 노란색보다 흰색에 가까웠어요 제형은 부드러운 세럼 느낌이고 수분감과 약간의 유분감이 느껴졌어요 약간의 유분감은 레티놀 제품이면 다 느껴지는 거라 크게 문제 되진 않았습니다 흡수도 잘 되고 이후에 피부 화장을 방해하지도 않아용 모공이나 피부결에는 딱히 효과가 없었어요 피부에 자극 안 가는 선에서 매일 사용한 건데도 2주가 지나도록 효과가 안 느껴져서 슬펐음 저는 타 레티놀 제품을 사용했을 때도 크게 효과 본 편이 아니라 이니스프리 거 쓰고 초반에 피부결 반짝 좋아졌었으나 이후 세 통을 쓰는 두번다시 효과는 나타나지 않았음 얘도 큰 기대 사용하긴 했지만 모공 축소나피부결 개선은 고사하고 잡티 흔적 옅어지는 것조차 변화가 없었으니 실망하게되는건 어쩔수없네요 총평 레티놀이 들어가서 그런가 가격대가 있는데 가격값을 하는지는 잘 모르겠는 기존에 레티놀이 잘 맞았던 분들은 한번쯤 써보셔요,"아이오페, 레티놀이",아이오페 레티놀 슈퍼 바운스 세럼,복합성,"주름개선, 보습"
제가 매일 꾸준히 바르고 있는 레티놀 입니다 항상 아이오페는 구성기획이 좋아서 맘에 들어요 본품 펌핑해서 발라주고 있고 비싸다 보니까 가득 까지는 아니고 양 조절해서 소량씩 꾸준히 발라주고 있습니다,"제가, 매일",아이오페 레티놀 슈퍼 바운스 세럼,복합성,"주름개선, 보습"
양은적지만 만족도는 굉장히 높은제품이에요 주위에서도 호불호없이 좋아했어요,"양은적지만, 만족도는",아이오페 레티놀 슈퍼 바운스 세럼,복합성,"주름개선, 보습"
가격은 나가지만 그만큼 효과가 좋아요 레티놀 순하고 진정효과도 좋은 같아요 꾸준히 사용해보니 모공도 작아진 같아서 만족스럽습니다,"가격은, 나가지만",아이오페 레티놀 슈퍼 바운스 세럼,복합성,"주름개선, 보습"
만족스럽게 사용후 여러번 재구매한 제품이에요 나이트케어용으로 사용하기 좋아요 기획 구성은 계속해서 바뀌던데 스텝3 크림 기획구성일때 구매했고 스텝3 크림도 좋았어요 레티놀 사용이 처음 이거나 민감하신 분들이 사용하기 좋은 제품이에요 자극이 적고 트러블 부담없이 사용 가능한 제품이라 좋았어요 0015 레티놀을 함유하고 있고 레티놀 입문자템으로 데일리로 탄력과 모공관리하기 좋아요 산뜻하지만 촉촉하게 발리는 제품이에요 사용해보면 다음날 피부가 매끄러워지는게 느껴지고 탄력도 생겨서 만족스러운 제품이에요 낮과 밤에 사용이 가능하며 낮에는 꼭 자외선 차단제를 발라줘야해요 참고사항 저자극 제품이긴하나 처음 사용할 때에는 소량으로 시작해서 양을 늘려 사용하길 추천드려요 레티놀 제품이다보니 갑자기 많은양 사용하면 피부가 놀라서 자극이 될수 있어요 레티놀 제품은 나이아신아마이드 세콜지 히알루론산 매트릭실 등과 같은 제품과 사용시 궁합이 좋아요,"만족스럽게, 사용후",아이오페 레티놀 슈퍼 바운스 세럼,복합성,"주름개선, 보습"
된 레티놀 케어를 할 수 있는 찐템이에요 레티놀 아이오페 인정이요 모공 피부결 케어까지 한 번에 쌉가능,"레티놀, 케어를",아이오페 레티놀 슈퍼 바운스 세럼,복합성,"주름개선, 보습"
재재재구매템 레티놀 하나만 사라고하면 이거 꼽아요 평생 쓸거에요,"재재재구매템, 레티놀",아이오페 레티놀 슈퍼 바운스 세럼,복합성,"주름개선, 보습"
샘플 써보고 좋아서 본품으로 구매했어요 가격이 꽤 나가서 올영세일할 구매하네요 레티놀 처음 써보는데 쓰고 나면 피부가 부들부들해져서 신기했어요 레티놀 쓰고 수분크림 써주고 있는데 만족입니당,"샘플, 써보고",아이오페 레티놀 슈퍼 바운스 세럼,복합성,"주름개선, 보습"
500급에서는 이게 순한데 성능도 좋은 제품이에요 스쿠알란이 들어가 있어 특별히 샌드위치로 사용하지 않아도 된다는 점 큰 장점입니다 번을 재구매하고 계속해서 사용하게되네요,"500급에서는, 이게",아이오페 레티놀 슈퍼 바운스 세럼,복합성,"주름개선, 보습"
이것도 바르고 다음날 되면 피부가 보들보들해요 쓰다 멈추지 않게 미리 삽니다,"이것도, 바르고",아이오페 레티놀 슈퍼 바운스 세럼,복합성,"주름개선, 보습"
비싸서 레티놀세럼 중에선 좋아여 비싼게 흠ㅠㅠ,"비싸서, 레티놀세럼",아이오페 레티놀 슈퍼 바운스 세럼,복합성,"주름개선, 보습"
레티놀이 들어있지만 순해서 좋아요 아이오페라 믿고 사용할 수 있어서 안심이 됩니다 아침에 사용하는데 꼭 선크림 발라야 저녁에는 레티놀 01바르고 있어요,"레티놀이, 들어있지만",아이오페 레티놀 슈퍼 바운스 세럼,복합성,"주름개선, 보습"
아침에 비타민 저녁엔 레티놀을 쓰는 편인데 이거 좋아요 레티놀인데 자극적이지 않습니다 아침에 일어났을 피부가 더 쫀쫀해진 같은 느낌입니다,"아침에, 비타민",아이오페 레티놀 슈퍼 바운스 세럼,복합성,"주름개선, 보습"
사용해보구 좋아서 비싸지만 쓰게되네요 기획상품도 자주 나와서 자꾸 지르게돼요,"사용해보구, 좋아서",아이오페 레티놀 슈퍼 바운스 세럼,복합성,"주름개선, 보습"
다들 아이오페 좋다고 하길래 세럼으로 구매해봤어요 다들 아이오페 아이오페 하는 지 알겠는ㅜㅜ 기초 다 아이오페로 바꿀 생각,"다들, 아이오페",아이오페 레티놀 슈퍼 바운스 세럼,복합성,"주름개선, 보습"
레티놀 제품을 여러개 써봤는데 아이오페 제품이 발림성 같은 사용감이 마음에 들어요 뚜껑이 되게 커서 실제 용량보다 용기가 넘나 크게 느껴지는 디자인인데 조금씩 소량으로 바르니까 약 한달 쓰네요,"레티놀, 제품을",아이오페 레티놀 슈퍼 바운스 세럼,복합성,"주름개선, 보습"
피부결 정돈에 최고인 세럼입니다 레티놀도 발라봤지만 꾸덕하고 날 결이 좋아짐이 느껴지는 제품입니다 두 번 펌핑해서 얼굴 전체에 발라주면 좋고 크림처럼 부드러운 텍스쳐라 발림성 마음에 듭니다 주변에서 레티놀 구매한다고 하면 아이오페 제품 추천입니다,"피부결, 정돈에",아이오페 레티놀 슈퍼 바운스 세럼,복합성,"주름개선, 보습"
아이오페 효도템입니다 엄마를 샀는데 저도 쓰고있어요 바르고나면 피부에 광이나요 다음엔 엄마한테 사달라고할까봐요ㅋㅋㅋ 샘플도 많이주셔서 엄마 본품드리고 저는 샘플쓰는데 본품못지않게 많이주셔서 아직도 잘쓰고있어요,"아이오페, 효도템입니다",아이오페 레티놀 슈퍼 바운스 세럼,복합성,"주름개선, 보습"
레티놀 중에 손이 많이가는 템이에요 국밥같은 템이랄까 바를때는 막 좋다 이걸 알지 못하는데 사용하다가 안하면 빈자리가 느껴지는 세럼인 거 같아요 용량이 적긴하지만 아이오페 답게 샘플을 본품 용량 줘서 꽤 오래 사용할 수 있어요 이번에 받은 핸드크림 사은품도 잘쓰고 있습니다 ㅎ,"레티놀, 중에",아이오페 레티놀 슈퍼 바운스 세럼,복합성,"주름개선, 보습"
레티놀 이것저것 써봤지만 아이오페 추천해요 보습감도 좋고 바른 후 달라짐이 눈에 보여요,"레티놀, 이것저것",아이오페 레티놀 슈퍼 바운스 세럼,복합성,"주름개선, 보습"
얘는 평생템이에요 얼굴에 뭐 나는 같으면 이거 바르고 자면 다 없어짐,"얘는, 평생템이에요",아이오페 레티놀 슈퍼 바운스 세럼,복합성,"주름개선, 보습"
오특으로주문 빠른 배송해주셔서 잘 받았습니다 주문할게요,"오특으로주문, 빠른",아이오페 레티놀 슈퍼 바운스 세럼,복합성,"주름개선, 보습"
레티놀 꾸준히 사용하다보니 안쓰면 다른게 티가 나더라구요 아이오페가 유명한 이유가 있는거같아용,"레티놀, 꾸준히",아이오페 레티놀 슈퍼 바운스 세럼,복합성,"주름개선, 보습"
예민한 피부애도 버르기 좋아요 복합성 수부지 추천드립니더,"예민한, 피부애도",아이오페 레티놀 슈퍼 바운스 세럼,복합성,"주름개선, 보습"
쟁여놓고 쓰는템이예요 레티놀 제품 써봤는데 이게 제일입니다,"쟁여놓고, 쓰는템이예요",아이오페 레티놀 슈퍼 바운스 세럼,복합성,"주름개선, 보습"
모공 개수가 줄어들게 만드는 제품이에요 간단하게 사용하기에 좋아요,"모공, 개수가",아이오페 레티놀 슈퍼 바운스 세럼,복합성,"주름개선, 보습"
레티놀 중에 아이오페가 뭔가 손이 많이가요 국밥템입니다 순하고 보습도 잘돼요 아이오페는 증정이 빵빵해서 더 좋습니다 온 필패드도 맘에 들어요,"레티놀, 중에",아이오페 레티놀 슈퍼 바운스 세럼,복합성,"주름개선, 보습"
레티놀 제품 중에 최고는 아이오페 같습니다 피부가 매끈하게 결이 좋아지고 트러블 자국 회복 속도도 빠르고 좋아요 기획세트 구성에 선크림도 추가 되어서 좋네요,"레티놀, 제품",아이오페 레티놀 슈퍼 바운스 세럼,복합성,"주름개선, 보습"
엄마가 10년 넘게 꾸준히 사용하는 브랜드라 아묻따 결제해요 구성 혜자,"엄마가, 10년",아이오페 레티놀 슈퍼 바운스 세럼,복합성,"주름개선, 보습"
주름과 모공에 효과가 있기를 기대하며 꾸준히 사용 중입니다 잘 쓰고 있습니다,"주름과, 모공에",아이오페 레티놀 슈퍼 바운스 세럼,복합성,"주름개선, 보습"
이니스프리 사용하다 아이오페로 올럈는데 사실 다른효과는 못느끼지만 꾸준히 쓰는중입니당,"이니스프리, 사용하다",아이오페 레티놀 슈퍼 바운스 세럼,복합성,"주름개선, 보습"
아이오페 세럼을 바르고 나면 피부가 당겨지는 느낌이 나면서 탄력이 생기는 같아요 기능성 제품이라서 거겠죠 크림은 꼭 발라줘야 꾸준히 사용 중이에요,"아이오페, 세럼을",아이오페 레티놀 슈퍼 바운스 세럼,복합성,"주름개선, 보습"
순하게 피부를 조여줘서 좋습니다 레티놀의 명가 아이오페 믿고 쓰려고 합니다,"순하게, 피부를",아이오페 레티놀 슈퍼 바운스 세럼,복합성,"주름개선, 보습"
자극이라긴 건조함이 느껴지고 사용하니 붉어져서 아주 소량씩 사용해보고있어요ㅠㅠ 샘플쓰고 있는데 효과는 모르겠어요,"자극이라긴, 건조함이",아이오페 레티놀 슈퍼 바운스 세럼,복합성,"주름개선, 보습"
얼굴에 오돌토돌한 게 생긴 날에는 꼭 아이오페 레티놀을 발라주고 자요 신기하게도 하룻밤 사이에 피부가 더 깨끗해지더라구요 피부가 예민한 편인데도 따갑거나 부작용도 없어 계속해서 구매하며 사용하고있어요,"얼굴에, 오돌토돌한",아이오페 레티놀 슈퍼 바운스 세럼,복합성,"주름개선, 보습"
레티놀하면 아이오페인 걸 알고 있었지만 혹시나 자극이 있을까봐 이니스프리 제품 먼저 써보고 괜찮아서 아이오페 세럼 사봤어요 라방 혜택 구성이 좋았고 세럼 발림성도 흡수력도 다 맘에 들어서 피부가 쫀쫀해진 느낌 드는게 아주 만족스러웠습니다 샘플을 받아서 한 세트는 아직도 개봉 전이에요,"레티놀하면, 아이오페인",아이오페 레티놀 슈퍼 바운스 세럼,복합성,"주름개선, 보습"
이미 쓰고있는 제품도 많지만 기획세트도 좋고 증정이 많아서 쟁여두려고 구입했어요 배합이 잘되있어 특유의 자극이 적어 레티놀 처음 입문하시는분들이 쓰기에 아주 좋아요 아침 저녁 사용가능하지만 아침에 바를땐 자외선 차단제를 꼭 발라주세요,"이미, 쓰고있는",아이오페 레티놀 슈퍼 바운스 세럼,복합성,"주름개선, 보습"
레티놀이 잘 받는 피부라 이것저것 사용해봤는데 구매해본 제품중에서 만족스러웠어요 피부 자극감도 없고 나이트케어에 사용해주면 다음날 피부 속광이 느껴질정도로 빠른 효과를 체감했습니다 전반적인 피부 컨디션을 끌어올리고 싶은 분들에게 추천하는 제품이에요,"레티놀이, 받는",아이오페 레티놀 슈퍼 바운스 세럼,복합성,"주름개선, 보습"
기획세트가 더 좋아지네요 아이오페 레티놀이 피부에 젤 맞고 순해서 매일써서 빨리 떨어져서 기획세트보고 재구매했어요 샘플로 레티놀 더 주는게 굳ㅋㅋ 통 쓰는지 세는걸 까먹은 양이 저에게는 작지만 도자기같은 용기도 고급지고 펌핑양도 2번이면 얇게 얼굴 전체적으로 잘 바를 수 있어서 더 좋아요 향도 없고 무거운 제형이 아니여서 흡수도 빠르고 발림성도 좋고 저녁에만 발라주는데 피부장벽이랑 피부결도 개선됐고 모공도 더이상 늘어지지 않아서 좋아요 세일 자주 해주세용ㅎㅎ,"기획세트가, 좋아지네요",아이오페 레티놀 슈퍼 바운스 세럼,복합성,"주름개선, 보습"
레티놀 입문템으로 제품 추천하는 후기를 봤는데 사용해보니 알 같더라고요 레티놀이 피부에 적응하는 기간이 필요한 성분이다 보니 일정 주기를 두고 사용해야 하는데 제품은 순하다고 해야할까요 크게 적응 기간을 두지 않고 매일 사용해도 괜찮더라고요 크림이랑 세럼 추가 증정으로 요긴하게 사용하고 있습니다 디자인도 독특하면서도 매력적이네요,"레티놀, 입문템으로",아이오페 레티놀 슈퍼 바운스 세럼,복합성,"주름개선, 보습"
레티놀중에 잘맞고 좋아하는 제품이예요 건성피부인데 이거 하나만 발라도 건조함을 잡아주고 흡수가 다른제품보다 잘되는 느낌이랄까ㅎㅎ 자극없고 촉촉하고 보습력까지 짱짱한데다 출시때부터 꾸준히 썼는데 익숙해졌을때는 모르다가 안쓰면 티나더라고요 개인적으론 리들샷조합 나이트루틴으로 좋아요 증정품도 풍성하고 구성도 자주 바뀌니 살펴보고 구매하시길 추천,"레티놀중에, 잘맞고",아이오페 레티놀 슈퍼 바운스 세럼,복합성,"주름개선, 보습"
늘 재구매하는 꾸준템 아이오페 레티놀이에요 이거 없으면 못사는 저 30대가 되면서 슬로우에이징에 집중하고 있어요 아이오페 레티놀은 빠른 시일내에 효과가 즉각적으로 보이기 더 인기가 많은 같아요 저같은 경우는 모공탄력 피부치밀도 개선에 효과를 느꼈습니다 주름도 정리된 느낌을 받았어요 사계절 없으면 안되는 필수템이에요,"재구매하는, 꾸준템",아이오페 레티놀 슈퍼 바운스 세럼,복합성,"주름개선, 보습"
모공에 탄탄력이 떨어지는 요즘입니다 이대론 안되겠다라는 생각에 두 레티놀과 두 메티노이드를 배합한 4중탄력이라는 광고를 보며 아이오페 세럼을 구입했어요 10여 일간 꾸준히 사용하면서 피부 속이 차오르고 모공이 줄어드는 받았습니다 이래서 아이오페 아이오페 하는 같아요,"모공에, 탄탄력이",아이오페 레티놀 슈퍼 바운스 세럼,복합성,"주름개선, 보습"
레티놀 맛집 아이오페 효과 좋은 레티놀 앰플을 꼽으라면 무조건 아이오페 레티놀 슈퍼 바운스 세럼을 선택할 거 같아요 브랜드 앰플보다 눈에 띄게 피부가 좋아지는게 보여요 피부 자극이 없지는 않지만 아이오페 레티놀 앰플에 덜 한편 자극 덜 효과 좋은 앰플이라 재구매할 예정입니당,"레티놀, 맛집",아이오페 레티놀 슈퍼 바운스 세럼,복합성,"주름개선, 보습"
아이오페 레티놀 슈퍼 바운스 세럼을 샘플들 받아서 일주일 써봤는데 괜찮더라고요 사람들 후기를 참고해서 본품두 구매했는데 역시나 기대를 저버리지 않았어요 세럼이 묽은 편이라 발림성이 좋고 피부에 빠르게 스며들어서 끈적임 산뜻하게 마무리돼요 복합성 피부인 저에게도 딱이더라고요 꾸준히 사용하니까 피부가 확실히 탄탄해지고 주름도 조금씩 옅어지는 느낌이에요 특히 피부 결이 매끄러워지고 모공도 줄어든 같아요 피부가 촘촘해진 느낌 레티놀 제품이라 처음엔 걱정했는데 자극이 없어서 아침저녁으로 부담 쓸 수 있었어요 아침에 사용할 땐 자외선 차단제 꼭 챙겨 바르는 거 잊지 마세요 아이오페 레티놀 슈퍼 바운스 세럼은 안티에이징 효과를 기대하는 분들에게 추천하고 싶고 꾸준히 쓰면 피부가 확실히 달라지는 걸 느낄 수 있을 거예요 결이 좋아집니다,"아이오페, 레티놀",아이오페 레티놀 슈퍼 바운스 세럼,복합성,"주름개선, 보습"
저는 제품을 년째 사용 하고있는제 모르겠어요 좋은 제품이에요 자극없이 순해요 순한제품 못 봤을 정도로 너어무 순하고 피부결 정돈에 제잉 큰 영향을 주는 칭구에요 이건짐짜 세일할때 왕창 쟁여둬야해요 ㅠ,"저는, 제품을",넘버즈인 3번 보들보들 결 세럼,복합성,"모공, 다크서클"
거짓말이 아니라 이거 몇년 쓰면서 5통 은 더비운거같은데 예민피부도 잘 쓰실거같고 사계절도 써도 ㄱㅊ을듯 뭐랄까 쓰면 쫀쫀 촉촉 해지고 화장직전에 여러겹을 발라도 좋을거같아요 짱,"거짓말이, 아니라",넘버즈인 3번 보들보들 결 세럼,복합성,"모공, 다크서클"
넘버즈인 오픈하자마자 홈페이지에서 산 사람인데 3번 결세럼 변함 예전에는 더 콧물제형에 쏙 들어가는 느낌에 속건조에 최고였는데 제품 리뉴얼 됐나요 화장품 회사들 진짜ㅋ 말 아낍니다,"넘버즈인, 오픈하자마자",넘버즈인 3번 보들보들 결 세럼,복합성,"모공, 다크서클"
모공피부결에 효과있는진 모르겠지만 피부에 발랐을때 느낌이 나쁘지 않은것 같습니다 정확한건 꾸준히 써봐야 알겠지만요 건성인 친구는 가볍다고 하는데 저는 촉촉함에 있어선 건조하진 않았던 같습니다,"모공피부결에, 효과있는진",넘버즈인 3번 보들보들 결 세럼,복합성,"모공, 다크서클"
퍼스널 컬러 겨울 클리어 봄영향을 받은 겨울클리어 타입 바우만 피부 타입 지성심한 민감성경미한 비색소성경미한 탄력 티트리 녹차 알로에 병풀시카 캐모마일 카렌듈라 살리실릭애씨드 판테놀 코코넛오일 쉐어버터 코코아버터 시나몬오일 시나믹애씨드 아세틱애씨드 벤조익애씨드 알파리포익애씨드 꿀피부 소리 듣지만 간혹 접촉성 피부염 재발로 홍조 두드러기 재발 술을 빚으시는 주조사분들의 손을 스킨케어에 적용시키기 시작됐다고 하는 피부의 기본기를 다지는 갈락토미세스 2 피테ㄹ 에센스 ㅆㅇㄴ 퍼ㅅㅌ에센스 ㅁㅅ 에센스도 마찬가지로 제품들을 썼을때 피부의 속광이 돌면서 결광이 달라지는걸 체감 후 갈락이 좋구나 느꼈었습니다 갈락이 들어가있는 앰플들을 써봤을때 트러블이 올라오면서 방황했는데 유일하게 안났던게 3번 앰플입니다 솔직하게 위 제품들을 썼을때만큼의 충격좋은의미를 받진 못했어요 이미 결이 부드러워서 그런건가싶기도 더 써봐야 할 같습니다 3번 에센스 토너는 안맞았습니다 특별함을 전 느끼지 못해서 재구매는 안할듯 합니다,"퍼스널, 컬러",넘버즈인 3번 보들보들 결 세럼,복합성,"모공, 다크서클"
유명한 이유가 있어요사용한 직후도 그렇고 다음날 보들보들 피부장벽에도 좋고 피부결이 완전최고 아쉬운 점이 없어요 건성복합성 ㅊㅊ 지성도 잘 사용할 수 있어요 끈적이지 않고 보들보들맨날 사용해요 양도 디자인도 보들보들 걍 다 보들보들 좋네요 피부결 고민이시면 구매ㄱㄱㄱ,"유명한, 이유가",넘버즈인 3번 보들보들 결 세럼,복합성,"모공, 다크서클"
